#MikeBrown's mother: ""Police not telling us nothing, cause they have nothing to say." #Fergusonhttp://t.co/P7QwG3sTru	0
Amerika appears to be awash in all manner of #terrorism. Much of it state-sponsored. #Ferguson #MikeBrown #Racism #p2http://t.co/PqIKIbVGtf	0
Outside #Ferguson Police Headquarters right nowhttp://t.co/ZqOQuisJgh	0
Follow @MichaelSkolnik NOW if you want to follow the story about #MikeBrown, the unarmed teenager who was killed by the #Fergusonpolice.	0
There should be blame AND shame here. #Ferguson #MichaelBrown @KharyPhttp://t.co/hXWpgy4nRY	0
Lots of people -- some prayerful, some sad, some angry -- have gathered outside the #Ferguson police headquartershttp://t.co/KfbHCGNrzk	0
Don't shoot! Don't shoot!" #fergusonhttps://t.co/PhairpOfdl	0
Police and protesters face to face in #Fergusonhttp://t.co/C0U0rQzGFa	0
happening now in #fergusonhttps://t.co/MYPxUyo7Xx	0
The courage it takes to to write these words down, much less display them to the world #Ferguson #MikeBrownhttp://t.co/6lt6JlBKCC	0
Protestors have crossed the police line in #Fergusonhttps://t.co/Y2CxIZe4Hk	0
Protestors have packed the lobby of the #Ferguson police headquarters. Not being let into the press confere...https://t.co/auVlJeqMoI	0
Don't shoot! Don't shoot!" #fergusonhttps://t.co/5PjPp1jdiL	0
Live from #Fergusonhttp://t.co/VX2zpW8Tqh	0
Press conference is over.  Important to note: NO mention of #MikeBrown stealing ANYTHING from ANY store.  #Fergusonhttp://t.co/CnX88sZEwY	0
Our problem is not with Hamas. Our problem is not in Iraq. Our problem is in #Ferguson!" - Anthony Shahidhttp://t.co/o1dZ3LDHdg	0
#Ferguson Police Chief said only one word during entire press conference. \n\nQuestion: Is officer is still being paid? \n\nAnswer:Yes.	0
Whenever you want to justify shooting an unarmed person you always say they reached for your gun. George Zimmerman taught us that#Ferguson	0
Powerful video of protestors w/hands up mocking #Ferguson police. Video via @AntonioFrench #MikeBrownhttps://t.co/PVXgMmgw20	0
Protest in #Ferguson. The police dogs are visible again.https://t.co/Fvdw0cKGXk	0
The presence of police dogs in #Ferguson is, at the very least, culturally and historicallyinsensitive.	0
Lots of angry mothers here in #Ferguson this morning.http://t.co/RXTdkGgDMG	0
WE DEMAND THAT POLICE STAY AWAY FROM US WITHOUT WEARING CAMERAS FOR OUR PROTECTION! #mikebrown #Fergusonhttp://t.co/L2rBjMMpzc	0
*church fan* RT @Sherrea_D: Where's the #NRA's call for blacks to arm themselves against the police? #MikeBrown#Ferguson	0
Still conflicting reports about death of the witness. Police say it's not true. Tempers are rising here in #Fergusonhttp://t.co/nbbr7XvJxk	0
#Ferguson, Missouri Community Furious After Teen Shot Dead By Policehttp://t.co/UJYaBibSvq\n#FergusonShooting	0
Not sure what the #Anonymous message to #Ferguson is going to be exactly but you can count on one.\nSupport@OpFerguson	0
No Skittles, Arizona Iced Tea, Cops On Scene. Another Black Teen Dead. Whats Their Excuse Now?. #Ferguson #MikeBrownhttp://t.co/d0CvLFAnQK	0
Hello fellow white people. Lets try to show as much outrage for #Ferguson as we did for Facebookmessenger.	0
This would help tremendously. #mikebrown #Fergusonhttp://t.co/FNVnuZLWd1	0
The protest is turning into a memorial and moving from the #Ferguson Police HQ to the street where #MikeBrown waskilled.	0
RT @TOO_LIVE_MILZ: The sad truth RT @kupkakekami: This would help tremendously. #mikebrown #Fergusonhttp://t.co/2i6aBcHlP3	0
The shooting in #Ferguson highlights why the federal government should be underwriting body cams for all cops rather than militarygear.	0
So #Ferguson police want me to believe #MikeBrown tried to get into a police car and wrestle the officer's gun away. I'm gonna needvideo.	0
#Ferguson #BundyRanch #Hypocrisy / H/T to @Khary for the images.http://t.co/rt7u6zOA1p	0
Hands up!" in #Fergusonhttp://t.co/gKKb0V0xv4	0
Every Black person should drill this in their heads:we are in Jim Crow 2.0..and the new lynch mobs and KKK members ARE THE POLICE#Ferguson	0
How police treat white #opencarry supporter vs an unarmed black teen. Wonder why? #MikeBrown #Fergusonhttp://t.co/jG3hGJRAuC	0
Vigil for shooting victim Mike Brown will be held at 8pm Sunday at Canfield Green apartment complex in#Ferguson	0
Nothing has changed. The ONLY difference?  The pictures are in color.  #Ferguson #FergusonShootinghttp://t.co/iRBqXc019M	0
#MikeBrown's tragic death isn't a #Ferguson problem or a #Missouri problem, it's an American problem.\n\n.http://t.co/g7jakSP9UL	0
Notice how they bring out the attack dogs? #FergusonShooting #Ferguson #FergusonPolicehttp://t.co/GpQT6cGLgJ	0
Don't shoot! Don't shoot!" #ferguson https://t.co/HJk5k2e8tI	0
When Parenting Feels Like a Fool's Errand: On the Death of Michael Brown: http://t.co/HrVKxjM3RR #MikeBrown #Fergusonhttp://t.co/tT0lYR8yCB	0
#Ferguson v #Bundy: Black jaywalking teen shot &amp; killed by cops. White trespassig rancher's militia aim guns at cops.http://t.co/MEGjYq2feR	0
Don't shoot! Don't shoot!" #ferguson https://t.co/qxvFf6BaWX	0
When's the last time a white kid was unjustly killed by law enforcement?\nJust spread the word http://t.co/8ZkPYTRS3I #MikeBrown#Ferguson	0
Let's get these cameras on cops everywhere #Fergusonhttp://t.co/u89uNkNGoS	0
There's cameras on every corner of the hood.  Let's out cameras on every cop.  What do you have to hide? #Fergusonhttp://t.co/76T6HmnsnS	0
BREAKING: AG Eric Holder has instructed attorneys in the department's civil rights division to monitor developments in #Ferguson.-@AP	0
if you Retweet or Screenshot. Just spread the word we need #Justice" #ferguson #stlouis #MO  #uniteblue #libcrib #p2http://t.co/78QURveWvK	0
If u r white &amp; u r not outraged about #Ferguson then the problem is much bigger than the police.#americaforall	0
Protestors have blocked West Florissant, a major street in St. Louis County. #Fergusonhttp://t.co/S15XpF4f9E	0
#Ferguson #MikeBrown protestshttp://t.co/UubTxFmU7c	0
R.I.P. #MikeBrown.\n\nInnocent teen murdered by #Ferguson police.\n\n#RETWEET for respect &amp; spreading his story.http://t.co/JMlG8ePjEj	0
Michael Jackson: ""It doesn't matter if you're black or white."\nReality: #Ferguson #MikeBrown \nThe War isn't on whiteshttp://t.co/0rW38CxQjn	0
The anger and tension is definitely worse than last night.#Ferguson	0
Happening now in #Fergusonhttp://t.co/w8r9FTl4Kb	0
Sad Survival Lessons We Have To Teach Our Young Black Boys. #JusticeForMikeBrown #MikeBrown #Fergusonhttp://t.co/SDDS5T0hEn	0
Some signs from the earlier shutdown of West Florissant in #Fergusonhttp://t.co/ATqNIOoQNS	0
Family of #MichaelBrown talks about his life: http://t.co/kIye34DLiU. #STL #Ferguson #MikeBrownhttp://t.co/GJgipAsWGV	0
#Ferguson protestors have shut down a major intersection https://t.co/2sLJdYKrP4	0
Happening now in #Ferguson where #MikeBrown was killed.http://t.co/LfN0DWYp0B	0
I don't know how this is going to end. But man, it doesn't feel good right now. #fergusonhttp://t.co/OKwtolhshi	0
Tell @TheJusticeDept to rigorously investigate &amp; prosecute all #Ferguson police involved in execution of #MikeBrownhttp://t.co/Z6PmH1EBdX	0
#Ferguson right now: Those who want a riot, come prepared for a riot. Heavily-armed officers are moving in.http://t.co/35em8bo5Xh	0
The #Ferguson police look more militarized now than the actual National Guard, here from the 1967 Newark riots:http://t.co/qk3CKqSp8o	0
Something being talked about tonight is the makeup of the #Ferguson Police Dept. Here's a breakdown: #MichaelBrownhttp://t.co/faix6g9Omt	0
PHOTOS:: #Ferguson, Missouri, looks like a war zone http://t.co/N7lfddXd5dhttp://t.co/hmPP9z4dGd	0
The protestors have started marching into a neighborhood. Police still standing here. #Ferguson #MichaelBrownhttp://t.co/2CFDkmtObA	0
Who is in Ferguson? Who can livestream? Who can tweet? The world needs to know what is going on. Let's show them. #Ferguson#OpFerguson	0
The fatal shooting of an unarmed teenager deserves a full review." AG Eric Holder #MikeBrown#Ferguson	0
Army tactical gear\nThis image is not from  #iraq or #Afghanistan this is #Ferguson MO #MichaelBrown fatal shootinghttp://t.co/4f5hYlONnV	0
You a reporter, big boy? See. They're treating you like they do us." A #Ferguson protestor who's quickly become one of my favorites toldme	0
The sights and sounds from #Ferguson, Missouri are unbelievable: http://t.co/D0n0QYN8x2http://t.co/A3obQOvf4o	0
Anonymous hacking group threatens the #Ferguson police in wake of the murder of Mike Brown --&gt; http://t.co/TqaA59wH9xhttp://t.co/p8VtikmeyD	0
Federal grants drive cop militarization: in '12 St. Louis County got Bearcat armored vehicle, other goodies http://t.co/uZymzagDmU#ferguson	0
So, @maddow is telling the story about how the #StLouis Police were harassing the whistleblower who detailed racism in the PD.#Ferguson	0
The police* are the occupying army in the black colony. - Huey Newton #Ferguson police #MichaelBrownhttp://t.co/dWzjeIccxw	0
The whistleblower, a white man who went by the name of ""Lonewolf," said Black people should be allowed to shop w/o harassment.#Ferguson	0
The whistleblower was putting his Lieutenant on blast. Nine other officers corroborated the rampant racism in the #StLouis PD.#Ferguson	0
The whistleblower said they would often have ""Black day" or "tan day" to just arrest Black or Brown people by the #StLouis PD.#Ferguson	0
The whistleblower said the #StLouis PD told the Black officers, ""Oh, not you... you're the good guys."#Ferguson	0
After the whistleblower revealed what was happening, he was summarily harassed, got drug tests, car taken &amp; transferred. #Ferguson#StLouis	0
The whistleblower said it wasn't his intention to take the #StLouis PD down but he HAD to say something. He filed a lawsuit.#Ferguson	0
Police still at one end of W. Florissant, protesters now at Greater St. Mark Church. #Ferguson p/v @JustinGlawehttp://t.co/ujLgUmKLNS	0
Peaceful youth demonstration at Greater St. Mark Church #fergusonhttp://t.co/feWLxdme9R	0
Peaceful youth demonstration at Greater St. Mark Church #fergusonhttp://t.co/acvuzlAN5l	0
Peaceful youth demonstration at Greater St. Mark Church #fergusonhttp://t.co/TEEq3mhoxu	0
Peaceful youth demonstration at Greater St. Mark Church #fergusonhttp://t.co/AAIO2DPlTn	0
Get out your cars. Join us!" say youth demonstrators. #fergusonhttp://t.co/gxJ20e35lv	0
An 88-year-old woman has joined the youth in #Fergusonhttp://t.co/dfDid2xV8X	0
Mound City Bar Association has agreed to donate their time PRO BONO, for ANY WITNESSES that would like to come forward. #Ferguson#MikeBrown	0
Tell me again how this guy points loaded rifle at cops w impunity &amp; unarmd black men get killed #Ferguson\n\n#UniteBluehttp://t.co/QBldRbRKBO	0
The Mound City Bar Association is offering pro-bono representation to all witnesses of #MikeBrown shooting.#Ferguson	0
How the federal government is militarizing police departments: http://t.co/IhP182VMRo#Ferguson	0
88-year-old Creola Mccalister has joined the youth in #Ferguson http://t.co/dfDid2xV8Xhttp://t.co/potRilWqvb	0
Hands up! Don't shoot!" #fergusonhttps://t.co/svCE1S0Zek	0
Not a cop in sight at the #MichaelBrown rally and all is peaceful.#ferguson	0
Remember: This is how #Ferguson protests began.\n\nBefore dogs, tear gas, rubber bullets, intimidation, No-Fly Zone...http://t.co/i43EVto9nc	0
Anonymous hacking group threatens #Ferguson police in wake of Shooting  http://t.co/wNjBvxk6MU http://t.co/Vrwv1EdRhM"" via @BET	0
The #Ferguson police have NOT interviewed the primary eye witness to Michael Brown's murder &amp; they won't release how many times he wasshot.	0
The world now knows his name, tonight get to know Mike Brown the person @fox2now at 9 #fergusonhttp://t.co/jBNenRkexL	0
Wow. From responses, it seems people only know about what's happening in #Ferguson from web. What happens when gov ends netneutrality?	0
Next up on Fox News: Here's some footage of angry black people in #Ferguson with no discussion about why they're angry.Enjoy!\n#MikeBrown	0
And They Call #Conservatives Terrorists?\n\n#tcot \n#Fergusonhttp://t.co/NTpxGviqLB	0
There's a town that's a no-fly-zone with a media blackout right in the middle of our country. Let that sink in.#Ferguson	0
Quiet where I am. Lots of talking. Lots of standing. No smash-smash. #Fergusonhttp://t.co/dXiIc5EQqq	0
Destruction of property and destruction of life are false equivalents. #MikeBrown#Ferguson	0
Something being talked about tonight is the makeup of the #Ferguson Police Dept. Here's a breakdown: #MichaelBrownhttp://t.co/gYd5qgJh5M	0
Love. #fergusonhttps://t.co/CKUpWXYjkC	0
NO VIOLENCE! JUST JUSTICE! #fergusonhttps://t.co/3R6rTtmvzW	0
White twitter doing what they do best... #Ferguson #FergusonShootinghttp://t.co/Ks2YLkYmEJ	0
This isn't a riot story. My latest, on why the ""hands up/don't shoot" protest is so important in St. Louis: http://t.co/VjJlU4Y2Fe#Ferguson	0
The occasional police car drives through and some shouts of ""F-ck the Police!" can be heard. But back to peaceful when they leave.#Ferguson	0
A Great Grandmother in #Ferguson came out &amp; stood with the young for #MikeBrown.  This is our city.http://t.co/liKmCfhQ9b	0
#STL A cleanup for #Ferguson has been organized. TOMORROW. Meet at 10 am Wednesday August 13, 333 N Florissant Rd, Ferguson, MO63135	0
Two weeks before #MichaelBrown was killed he accepted Jesus Christ as his savior!#Ferguson	0
Keep #dontshoot going! That's the chant of our young people in #Ferguson!http://t.co/CBFBGd63TM	0
This is #Ferguson, a suburb in America.http://t.co/GfmHLo4u5q	0
MT @KLynnTrice  #Ferguson #FergusonShooting #MikeBrown http://t.co/ucqMi2JLxd. Best tweet of the day forme.	0
#BREAKING: A man just advanced on police. A red laser immediately was painted on his shirt. He threw his hands up. #Ferguson#MichaelBrown	0
#Ferguson picture from earlier in the day, high powered rifles trained on protestershttp://t.co/OYOur3ZCrA	0
When white folks start discussing how POC should respond to blatant or covert racism &amp; oppression. -_- #Fergusonhttp://t.co/bjqZDZFOCY	0
Putting out a specific call again: this story should be told by Black youth, from #Ferguson. If that's you, we have a platform, get atme	0
Cops warn the crowd. The photog's gas mask comes out. Someone is chanting ""Gaza Strip." #Fergusonhttp://t.co/IWJkOg8oy4	0
This is what the front line looks and sounds like. #Fergusonhttp://t.co/oIv0daVU8N	0
Protestor on bull horn: ""Is this the Gaza Strip you bombin'" #Fergusonhttp://t.co/rsPzBuPYb1	0
The #Ferguson police look more militarized now than the actual National Guard, here from the 1967 Newark riots:http://t.co/HupsfEWbIJ	0
Police told protesters to get out of street, they instead got on knees and said, ""Hands up! Don't shoot!" #Fergusonhttp://t.co/XFpEsXBwM3	0
Right now in #fergusonhttps://t.co/M0yp0a2Wwv	0
Crowd of about 250 ignoring order to disperse from W Florissant. #fergusonhttps://t.co/XsS38XIGPe	0
Officer ran up and I told him I was lost...didn't care. He cursed me out and called me a bitch. Pulled his gun out... #MikeBrown#Ferguson	0
I instantly broke down crying and scared for my own life. These officers do NOT care about me...or anyone black #Ferguson#MikeBrown	0
#Ferguson. Beware of violent street gangs in #ferguson. Here's what they look like.http://t.co/aAmfSnkQ3Z	0
Wherein a bunch of guys who served in Iraq and Afgh look at the #ferguson cops and say: WTF? http://t.co/moUOH56BJl via@BI_Defense	0
BREAKING: Instead of dispersing, protesters got on their knees with their hands up. http://t.co/mvPftWrnEs#Ferguson	0
When police are militarized, they go to war with citizens. #Fergusonhttp://t.co/WHMDzIegv1	0
Crowd peacefully dispersing at the QT tonight.#Ferguson	0
This is Rashaen Aldrige, 20. ""We're here to support the family, to let them know we have their back." #Fergusonhttp://t.co/DECQ2VzS6Y	0
Protest ending for the night. #fergusonhttps://t.co/wIf4bkrfEc	0
Missouri Mayor: Looters came from out of town. http://t.co/hv3mPdHtKC … Was he talking about Sharpton? http://t.co/qS4wm2BdsK#Ferguson	0
Do u know how powerful it is 4 blk ppl to be able to tell their OWN stories in the face of oppression?! That's what's happening in#Ferguson	0
These pro-Israel protesters with rifles in ATL werent ever approached by cops. It helps to be white #Fergusonhttp://t.co/0sDqDmJz8q	0
Slow parade of cars and walkers leaving #Ferguson tonight. Peacefully. ✌️http://t.co/FL5TKqmDW8	0
A cleanup for #Ferguson has been organized. TOMORROW. Meet at 10 am Wednesday August 13, 333 N Florissant Rd, Ferguson, MO 63135#MikeBrown	0
#Ferguson crowd gone, crowd showed restraint, chanted &amp; yelled at police then left, scene now empty, only media herehttp://t.co/Tu2LrnSG6c	0
A white man in Dallas set a fire, lured firefighters to the scene, shot 15 rounds at them last night...still alive.#Ferguson	0
To protect and serve" has become "To harass andshoot"\n#Ferguson	0
Prayers for#Ferguson.	0
St. Louis Co police confirm female shot in head in 1300 bl Highmont, near QT.  Appears to be drive-by shooting.#ferguson	0
Protestors in #Ferguson refuse to move, have put their hands up in front of police. #MikeBrownhttp://t.co/9TyLGy5cRU	0
This is not Kiev, Ukraine. This is #Ferguson, Missouri right now.http://t.co/RXZ0xkaBrP	0
Wow...A man picks up burning tear gas can and throws it back at police. #ferguson pic by @kodacohen @stltodayhttp://t.co/SASXU1yF3E	0
Chambers and W. Florissant right now. #Fergusonhttp://t.co/fLag6Sw0MU	0
My friend Torey just said ALL his local news channels have been blacked out too. OMG #Ferguson this is why there is a ""No Fly Zone"order!!	0
Arrest being made. Chambers and W. Florissant right now. #Fergusonhttp://t.co/plnA4OS2IY	0
St. Louis County police tell me woman shot in the head and that a Lt. on scene said she's ""alert and gonna live."#Ferguson	0
A witness describes the use of tear gas tonight. #Fergusonhttp://t.co/B6vi7M10ck	0
No-fly zones, military police, teargas, censorship, machine guns. In response to the murder of an innocent kid. We're fucked.#Ferguson.	0
Police fire tear gas at protestors for the third night in a row in Ferguson, Mo. #Ferguson #MikeBrownhttp://t.co/BEoZT5yjkU	0
Tanks. Military police. Occupation. Media blackout. No fly zone. In...a suburb. This is America in 2014.#Ferguson	0
RT @PDPJ: #Ferguson picture from earlier in the day, high powered rifles trained on protestershttp://t.co/qUkG9ztaQt	0
It's helicopters flying in #Ferguson. How a drive by happen and y'all ain't spot it??! With West Florissant COMPLETELY BLOCKEDOFF.	0
As all eyes r on the police murder of #MikeBrown in #Ferguson, 3 more unarmed Americans killed by police in LA, Dallas &amp; Tulsa in pastweek.	0
PHOTOS:: #Ferguson, Missouri, looks like a war zone http://t.co/wXClUFvfXHhttp://t.co/X0ScvTtUA2	0
All police officers in America should immediately be equipped with body cameras #Ferguson #PoliceStatehttp://t.co/zsuFqz08Ev	0
GOD BLESS YOU #Ferguson RT @Daaance_Ki: Howard family pray for our own @SpookPacShakur .http://t.co/fW2CJgno6A	0
Going 2 War With Americans #Fergusonhttp://t.co/HOHFomjgPp	0
RETWEET!!! Before any cops were called, before anyone knew he was killed! One of them is his killer #fergusonhttp://t.co/MGqiSoj1Ab	0
PLEASE DONT TRY TO BUY ME OUT, MONEY OR ANYTHING. MY STORY IS FOR JUSTICE. #Fergusonhttp://t.co/zL7bNqls22	0
The revolution may not be televised, but it's being broadcast LIVE on social media...And we're watching. #Ferguson#MikeBrown	0
So let me get this right - cops shoot an unarmed kid then put the town under effective martial law? In the USA? In 2014?#Ferguson	0
Today's events in one video:\nhttp://t.co/jMcAQI1ci9\n#ferguson#justiceformikebrown	0
When #Ferguson is just a town again - not a Twitter trend or a news story - a mother will still be without her son.http://t.co/mieUXka06T	0
I look at this and I'm proud. The protesters tonight in #Ferguson were NONVIOLENT. #MikeBrownhttp://t.co/4CNAP6j31U	0
even in Afghanistan we never pointed our rifles at civilians there is something seriously wrong with the police in#Ferguson	0
Hard to ask people to obey the law when The Law kills people w/ impunity. Riots &amp; civil unrest are offsprings of corrupt system.#Ferguson	0
I've said it before and I'm saying it again... Who are they really afraid of again?? #Ferguson #MikeBrownhttp://t.co/xxZa8B0npg	0
The American people are the new insurgents. #ferguson #PoliceStatehttp://t.co/iwQEwOd1gK	0
Damn #Ferguson #MikeBrownhttp://t.co/1qmphydgip	0
Your friendly local police department. Protect and Serve. #Fergusonhttp://t.co/LIUfLlnXXK	0
While the initial looting in #Ferguson was deplorable, it's clear the town is now the victim of a huge militarized police stateexercise.	0
There will be no #BlackOut or Censoring The Global Community from witnessing this #HUMAN travesty #Unity #Fergusonhttp://t.co/LcOVHIHivD	0
Is that a bag of chips?! #REAL RT @GinoTheGhost: May be the dopest photo of the year #Fergusonhttp://t.co/ZxF3zhbjHb	0
Welcome to the United Police States of America. #Fergusonhttp://t.co/Wau7wEohv1	0
No one should live in a town where militarized police point loaded weapons at unarmed citizens #Ferguson http://t.co/nk0Ugf0tpR#morningjoe	0
RT @manofsteele: Man picks up burning tear gas can and throws it back at police. #ferguson pic by @kodacohenhttp://t.co/tBIacVzMKE	0
RT @tabithalou: This what they not showing you on the media. These young men cleaning up after the riot. #Fergusonhttp://t.co/50AjPG6o3V	0
We don't need to stinkin' #PoliceState Americans!\nThis must stop!\n.@StupidTeanuts: Going 2 War w/ Americans #Fergusonhttp://t.co/lo4ZQ59DHS	0
This image is unreal. Cops in #Ferguson dressed &amp; armed for war, confronting a lone protestor http://t.co/QpEZQ7mPXqhttp://t.co/UUP2oXY6qf	0
Slain teen had notched a hard-fought victory: A diploma http://t.co/VNpRHaxFh6 #Ferguson#MichaelBrown	0
Because the news outlets are blatantly LYING about #MikeBrown murder and ignoring the clear coverup and militarization of#Ferguson	0
.@wizkhalifa showed support for #RIPMikeBrown last night during his #STL concert http://t.co/M7OBuIL1eV #Fergusonhttp://t.co/8FYpZQEWUb	0
Photos from @PDPJ #Fergusonhttp://t.co/CXXG6bPHh9	0
Classes started at 8am, but by 7am #MichaelBrown would be there waiting, eager http://t.co/SVaqe4vR2V #Fergusonhttp://t.co/P3ubd08DB8	0
All of yesterday's Vines in one YouTube video. #ferguson http://t.co/Q2wUmBg5Cr	0
UNEASY NIGHT: St. Louis Post Dispatch's reporting on last night's clashes in #Ferguson http://t.co/wHNNo9yo3Thttp://t.co/OOuZIRkjpL	0
The Civil Rights Act is 50 years old. These two pictures were taken 50 years apart. Behold our progress. #Fergusonhttp://t.co/8PNn8eteO2	0
Thought I was looking at a pix from Birmingham, Alabama in 1963 but nope I was looking at #Ferguson Missouri 2014 smhhttp://t.co/V3vuwlNBFF	0
The fact that while we've been focused on #Ferguson another black man was killed by cops in LA and it barely made the news says alot.	0
Also, the National Association of Black Psychologists will be on-site to provide free crisis counseling to residents of #Fergusontoday.	0
#JusticeForMikeBrown: Powerful photos from the #Ferguson police protests http://t.co/PfZ0GIAxE1http://t.co/I4x6KRgnHE	0
St. Louis area police forces are less diverse than communities they serve. By the numbers - http://t.co/L0svzVrZue #Ferguson#STL	0
#Ferguson vs #BundyRanch \n\nSee the difference?http://t.co/zKEMY38Uds	0
Last night in #Ferguson started with joyous hymns &amp; calls for peace. It ended with another police shooting. My latesthttp://t.co/ckmGk9TnWA	0
The police do not consist of a few bad apples, the institution itself is rotten to the core.#Ferguson	0
The events in #Ferguson Missouri remind us how and why America's police became so militarised http://t.co/wDnjslz0pkhttp://t.co/Fdr1r1KWpV	0
On a street in #Ferguson: Big wooden pellets &amp; aftermath, weapons used against peaceful protestershttp://t.co/hma5qv8pls	0
Black folks deserve a more honest account of racial politics than 'it's all love, overlook color, and give peace a chance.' #Ferguson	0
They say we destroying our own neighborhood. We don't own nothing out here." #Fergusonhttp://t.co/cVqf6kYkUL	0
Great piece from @nytimes about the role of racial segregation in places like #Ferguson http://t.co/yPo7ifTlcchttp://t.co/eE8ljLpqEZ	0
This is what they aren't showing you on the media. These young men cleaning up after the riot. #Fergusonhttp://t.co/eDH53pfQyg	0
A few feet from where #MichaelBrown was killed: #Fergusonhttp://t.co/BpMH784CFR	0
Armed gunmen shoot local man as part of their reign of terror in Iraq. Oops! Nope, that was police in #Ferguson. Mymistake.	0
If Michael Brown had shot and killed a #Ferguson police officer, would his identity be kept secret for his &amp; his family'ssafety?	0
You're either furious about this or protecting your entitlement. I believe it to be this simple: #Ferguson #Trayvonhttp://t.co/0SDoF5zobe	0
People of #Ferguson: Stop #attacking our brave #heroes! --http://t.co/DfxchWSDBM	0
WOW! #Ferguson police tell a resident a girl was shot in the head, she asks by who, partner of the cop silences himhttps://t.co/a0WfBzV5QU	0
#MorningReads: Terrifying result of police militarization on display in #Ferguson, MOhttp://t.co/hpJPTohzzi	0
Realist picture you will see today.. #Fergusonhttp://t.co/PAMtLUxIXm	0
Image of #Ferguson protester throwing tear gas back at police, wearing the American flag, is amazing. http://t.co/JXi1sibnGG@AntonioFrench	0
WAKE UP!!! #Fergusonhttp://t.co/4N8kRGBXUf	0
#BREAKING first official news release from #Ferguson PD since death of #MikeBrown @kmovhttp://t.co/Z27k2DOm7J	0
Looting &amp; rioting are terms that are loosely being used to describe all the civil disobedience in #Ferguson don't get it twisted#focus	0
