I'll be on @CNN in a few minutes discussing #Ferguson and#JusticeForMikeBrown.	0
Cops have changed since I was a kid #Ferguson #photohttp://t.co/qq3m6BI4c6	0
Ronald Johnson is proof that there can be cops who care about their communities &amp; will do right. But #Ferguson deserved that from dayone.	0
Justice must be served!  #Ferguson#MikeBrown	0
Are these cops or soldiers? Experts say #Ferguson police tactics have made tensions worse http://t.co/Bend3mL6SFhttp://t.co/DNnPmsswO9	0
Everyone was out to support. #MikeBrown #Ferguson #UnionSquare #nyc4stlhttp://t.co/z3VT5Sf51v	0
No justice! No peace! #Ferguson #FergusonShooting #FergusonRiot#MikeBrown	0
The City Is Ours #NYC #Ferguson #HandsUpDontShoothttps://t.co/0XQAlczZVo	0
The streets of Times Square have been taken over. Literally. #NMOS14 #fergusonhttps://t.co/ZnzqFhDdNI	0
World of difference: police walking with protesters, wearing normal uniforms, state Highway Patrol chief hugging it out.#Ferguson	0
#NMOS14 demonstrators holding up signs right now at Washington, DC's Malcolm X Park: #Ferguson http://t.co/s3nDHSeH8o V\n@news_2_share	0
Heading to #ferguson after rally, #michaelbrown's mother didn't speak, but thanked supportershttp://t.co/uE33pZXz43	0
Times Square right now for #Ferguson #MichaelBrownhttp://t.co/m0e1eFJet2	0
That iconic #Ferguson photo reminds me of somewhere. The West Bank.http://t.co/UVF5zYeaRV	0
The streets of #Ferguson look a little different tonight. | AP Photohttp://t.co/sHcsZtAs3v	0
Photo taken by @FroGoddess ""thanks for the advice #Palestine" - #Ferguson #STL #MikeBrownhttp://t.co/UkfKu2Zzdl	0
MORE VIDEO SURFACING - Early after-moments of #MikeBrown's death.  http://t.co/59dtqgkNft#Ferguson	0
Palestinians in #Gaza/West Bank have been showing support for #Ferguson. Even offering tips on dealing with teargas.http://t.co/Gc6ykBMU1l	0
How many lawsuits totalling how much $$$ are going to come out of the recent events in#Ferguson?	0
Remember the chief of #Ferguson police said that they covered the body and sealed the crime scene right away. Lyingagain.	0
Occupation is a CRIME,from #Ferguson to #Palestine!AntiWar Committee Chicago #StandWithFerguson #MikeBrown @AntiWarMNhttp://t.co/L64XNjeupc	0
#Ferguson fury flows nationwide: Thousands rally in more than 80 US cities http://t.co/kdgsBK4gzg@NastiaChurkina	0
Highway patrol helps restore calm in #Ferguson http://t.co/6auIQchChQhttp://t.co/7fXWeQrnzk	0
Occupation is a CRIME, #Ferguson to #Palestine! AntiWar Committee Chicago #StandWithFerguson #MikeBrown @AntiWarMNhttp://t.co/ll01iPsiPU	0
Thousands of New Yorkers shut down Times Square in support of #JusticeForMikeBrown #Fergusonhttp://t.co/4YiZ7WPjuR	0
@eyeFLOODpanties RT @iFalasteen: The oppressed stands with the oppressed.\n\n#Palestine stands with #Ferguson.http://t.co/vzR0xVk60Y	0
You know things are out of control in #Ferguson when people in #Gaza are tweeting advice on how to copehttp://t.co/HTovNvbOxv	0
Neutrality is not an option...\n\n#Ferguson #mediablackouthttp://t.co/tDzEczN7et	0
4 arrested in Times Square after march supporting #Ferguson http://t.co/I40SlR3Jbm #NMOS14http://t.co/QRT7VzEiRe	0
I salute #CaptainJohnson #Ferguson http://t.co/M7gdKWaVX4http://t.co/FZib7v9gA0	0
Palestinians in #Gaza/West Bank have been showing support for #Ferguson. http://t.co/yJSwwUtWJG	0
Don't Worry We're From the Internet....\n\n#Fergusonhttp://t.co/wb8CD2YAOr	0
St. Louis police chief condemns military tactics being used in #Fergusonhttp://t.co/6jmeZutuoe	0
#wakeup #MarshallLaw #Ferguson - America - how's that land of the free working out?http://t.co/uI9nWUXr8a	0
No matter what we do, it won't be as bad as killing a kid and leaving him to die on the street, covered with his own blood.#Ferguson	0
Thousands shut down Times Square last night in support of #Ferguson US where police shot unarmed teen #MikeBrownhttp://t.co/t2rNDX3Hju	0
Respect freedom...\n\n#Ferguson #mediablackouthttp://t.co/n4mZkWTQ4k	0
Stand down of riot cops in #Ferguson sends a powerful message - de-militarize police departments across America NOW.#HandsUpDontShoot	0
Obama has militarized every government agency there is. THIS is big government. #morningjoe #Fergusonhttp://t.co/SGOPtKpAqk	0
One of the great photos of American history taken by @kodacohen.  Things much more peaceful in #Ferguson last night.http://t.co/MIoN5P9QIW	0
Thanks to centuries of Western colonization of free nations, the term ""White" now refers to virtually all oppressors, even Obama.#Ferguson	0
Hannity throws a softball to #Ferguson Police Chief #UniteBlue #LibCrib #Bundy #morningjoe http://t.co/2AjrbA7TdIhttp://t.co/N7RCK8xAsq	0
After #Ferguson shooting, nearly half of Americans don’t believe in justice – poll http://t.co/WkNQk64sKbhttp://t.co/p74FItXUKC	0
No arrests last night in #Ferguson (per@BreakingNews)	0
This Remarkable Map Shows An Explosion Of Tweets About The #Ferguson Protests ➡️http://t.co/nQCESXiUgnhttp://t.co/GUyn4Wz08o	0
#PCKeeper #Kiev office would like to express our #Solidarity with #Ferguson . We know #PoliceBrutality #euromaidanhttp://t.co/INMT0JHMFS	0
One photo was taken in a failed state whose people live under martial law. The other is from Iraq. #Fergusonhttp://t.co/2UyiWNNZi9	0
Capt. Ron Johnson leads #Ferguson protestors through a peaceful night #RonJohnson #leader\nhttp://t.co/JpUnwUsN6fhttp://t.co/Vl504sVOaE	0
Ferguson police chief speaks with protesters early Friday am. #fergusonhttp://t.co/uFHeK4MyxT	0
#ThatAwesomeMoment when #America comes together as one in the face of adversity.\n\n#Ferguson #NMOS14 #MikeBrown #p2http://t.co/aQtJfINkoA	0
Protesters march peacefully alongside state troopers in #Ferguson: http://t.co/qqiQ0XKDRN (Scott Olson, Getty Images)http://t.co/D6DKEK0z5n	0
Thank you PBO. #Ferguson #MikeBrownhttp://t.co/TtTBLTrz0g	0
Mom, I'm going to college." #AmadouDiallo #lastwords #ferguson #michealbrown #policeagressionhttp://t.co/B0WbHO1BCU	0
Please don't let me die." #kimanigray #lastwords #policeagression #ferguson #michealbrownhttp://t.co/9oZNLJHg0n	0
Harvard Law students stand in solidarity w/#Ferguson and all innocent victims of #policebrutality  #HandsUpDontShoothttp://t.co/XbiwsJ5ieV	0
#HandsUpDontShoot Janelle Monae and her band stand in #solidarity w/#Ferguson #EndPoliceBrutalityhttp://t.co/OUEKfOAlSr	0
#Ferguson Police Chief Thomas Jackson: “I’m not going anywhere, I’m going to stay and see this through.” #NewDayhttp://t.co/ZFH4Hh0ty7	0
It Turns Out Policing Is Better Than Occupying http://t.co/ZuSmhXf9To via @HuffPostPol #Ferguson #Leadershiphttp://t.co/YxG9KVfnJH	0
New cops wear blue not camo, mingle and talk to protesters with respect -- and suddenly there's calm #Fergusonhttp://t.co/XY3NSpbqK8	0
Being a poor, black American makes you vulnerable; living in a poor, black area renders you collateral" #Fergusonhttp://t.co/4OMNeoRuYJ	0
Solidarity from London to #Ferguson \nVigil on Sunday 17th, outside US embassyhttp://t.co/dFIInwpL8u	0
Powerful, disturbing advice from the humans in #Gaza to the humans in #Ferguson on how to deal with military/police.http://t.co/4hxr1QEjLt	0
What a difference a day makes. http://t.co/7ojFubJi93 #Fergusonhttp://t.co/bnUftyC9Bi	0
Excellent commentary on #Ferguson courtesy of @TedRallhttp://t.co/vmQfpneeif	0
Muslims butchering Muslims no biggie 'til an Israeli kills 1. U.S. blacks killing other blacks=non event 'til a cop kills1\n#ferguson\n#tcot	0
Hands up! Don't shoot!" #Ferguson, MO, protests spread to nearby Clayton. http://t.co/s7KHztwXeqhttp://t.co/9Ww2erUujj	0
Hope replaces tear gas in #Ferguson http://t.co/OLTozbftqWhttp://t.co/Jzci5COXo1	0
Hip hop stepping up. Listen to @JColeNC Be Free http://t.co/HP6fgs7a7M dedicated to #MikeBrown#Ferguson	0
We have a lot of work to do. \n\nFrom @tnr: ""White St. Louis Has Some Awful Things to Say About #Ferguson"http://t.co/i856G2iRZk	0
This is probably the greatest thing I've seen so far #Ferguson #MikeBrownhttp://t.co/pvhEvqMQ9i	0
Morning in #Fergusonhttp://t.co/UzDihpw6M5	0
#Gazans advise #US protesters on #Twitter http://t.co/bIlucMYbwh\n\n#Ferguson #FreePalestine #presstvgazahttp://t.co/7RhD2CQgpa	0
#Ferguson chief tells me he ""didn't know" media was at @QuikTrip. Newser now 25 minutes late @kmov #MikeBrownhttp://t.co/2ucckGwtHZ	0
#Ferguson police once charged a man w/ destruction of property for bleeding on their uniforms: http://t.co/rkJjfC8U8thttp://t.co/IuusEfLyvY	0
This @johnlegend exchange is definitely the best thing to come out of Twitter, ever. #Fergusonhttp://t.co/iSnkNpJdr5	0
What happened in #Ferguson doesn't contradict America's racial narrative. It illustrates it."http://t.co/337F1OD330	0
After #Ferguson shooting, nearly half of Americans don’t believe in justice – poll http://t.co/oAz3qywdsVhttp://t.co/psxx3YvVlF	0
Oh, this new @JColeNC is very emotional, I suggest you take a listen. http://t.co/mrCwhINAXf#Ferguson	0
The #Ferguson Solution. My thoughts… http://t.co/7t2SafQeVsRT!	0
#Ferguson police name the officer who shot #MikeBrown. He is Darren Wilson\n#stl#MichaelBrown	0
#Ferguson police ID officer who shot and killed #MikeBrown as DarrenWilson.	0
#Ferguson, Mo., police identify Darren Wilson as the officer who killed Michael Brown lastweek.	0
The name of the #Ferguson police officer who killed #MikeBrown is Darren Wilson. He has been on the police force for 6years.	0
JUST IN: #Ferguson police chief identifies cop who shot Michael Brown as Darren Wilsonhttp://t.co/jeslX6oceR	0
BREAKING - #Ferguson's police chief has announced Darren Wilson as the cop who shot and killed#MikeBrown.	0
This Cartoon Says It All: via @BennettCartoons via Chattanooga Times Free Press #Ferguson #UniteBlue #libcrib #KYhttp://t.co/A5XHpJPq75	0
Haven’t seen a police chief run from a microphone that fast since Commissioner Gordon said the Joker was threatening Gotham City#Ferguson	0
RT @Smith83K This Cartoon Says It All: via @BennettCartoons via Chattanooga Times Free Press #Ferguson #UniteBlue #KYhttp://t.co/TwEej9WWme	0
5) if #Ferguson PD were already put on notice about a Quick-Mart robbery, why was that NEVER part of the narrative tillnow?	0
To hear the exact dispatch call the moments of #MikeBrown's murder: http://t.co/q4BV14ZToy#Ferguson	0
Ten Things White People Can Do About #Ferguson Besides Tweethttp://t.co/T3B5iQiibZ	0
Exactly how often do police shoot unarmed black men? http://t.co/m5X6ICFtdv #Fergusonhttp://t.co/elWTCmN3ZN	0
#Ferguson ""He fit the description" means "I can't tell black people apart" means "I never look at their faces or theirhumanity."	0
Wow. #Ferguson Police Chief struggles to remember #MikeBrown's name but laments the murdering cop's ""injuries." Prettytelling.	0
There's still no justification stated for #MikeBrown to be shot to death.#Ferguson	0
I'm so tired of society making black people defend themselves, even from under the grave. #Ferguson#MikeBrown	0
The #Ferguson police dept didn't say ""murdered" of course. Cops never "murder" people. Black people just "are shot" in proximity ofcops	0
Dear @donlemon:\n\nNo.\n\nSigned, \nEveryone\n\n#Ferguson#MikeBrown	0
.@HarvardBLSA students stand in solidarity with #MikeBrown &amp; the #Ferguson community. #HandsUpDontShoot #HBLSAhttp://t.co/XDZVHCgv7S	0
When people can't handle your content.....attack your character!#Ferguson	0
#Ferguson PD is putting on a show for the world. Forgetting the world is now watchingTwitter.	0
We are seeing, in high relief, why we need a federal government.#Ferguson	0
How can trust the profiling skills of the chief on a boy he never met but couldn't pick up the psychopath he worked with#ferguson	0
Right when we thought things were beginning to cool down, bam!#Ferguson	0
Follow Amnesty delegation on the ground in #Ferguson to observe, collect testimonyhttp://t.co/srQ7W2vAyx	0
Students at Howard University show solidarity w Michael Brown and protestors in #Fergusonhttp://t.co/m2unGRcFXI	0
Well, it took Twitter about 5 minutes to completely demolish the #Ferguson police's smearconference.	0
Cops or Soldiers? Pentagon, DHS Helped Arm Police in #Ferguson with Equipment Used in War http://t.co/HDGm3wFUL7http://t.co/qRH4Y1nWPy	0
I don't apologize for my blackness... Y'all got that? #FergusonShooting #Ferguson.http://t.co/FzVA1M9GRN	0
Our account from the ground in #Ferguson\nProtesting 4 #JusticeForMikeBrown? Know your rights https://t.co/bqWdKblUoMhttp://t.co/A60AYAS1GV	0
Protests continue at the QT #fergusonhttps://t.co/qF2N92L9Zn	0
So Americans think excessive police presence in #Ferguson was too much\n\nHow do you stop hooligans from looting? Ice Cream Truck andsongs?	0
Why do whites run a mostly black town? See what's fueling long-simmering tension in #Ferguson http://t.co/sgMZFUhch8http://t.co/K3s69KltKA	0
Let me be very clear: The #Ferguson police and America are playing with fire if there is an attempt to justify the murder of#MikeBrown	0
VIDEO: NY's Times Square shut down as 1,000 #Ferguson protestors chant ""Hands up, don't shoot" http://t.co/ou1TGSOQAdhttp://t.co/A8x9AfGFwQ	0
Activists" call #Ferguson PD "pigs," "racist," "apartheid," and "occupiers'--then ask why so few young blacks apply to becomecops.\n#tcot	0
Y’all notice #Ferguson &amp; St Louis county have NOT released the autopsy report. Trajectory of bullets matters in death of#MikeBrown	0
Media, we will not allow you to spin this story to make it seem as if #MikeBrown deserved to die. Nope. We won't let it happen.#Ferguson	0
I'm so very proud of you America. Every young, senior, veteran, sane non-violent person for justice #NMOS14 #Fergusonhttp://t.co/oVgY9x5Nzn	0
This is the sassiest protest sign I have ever seen. I love our black queens! 😭 #Ferguson #MikeBrownhttp://t.co/C6zk8Fwb0Y	0
In the USA, if a cop says something, it automatically becomes fact. By law media must report it as fact no matter how outrageous.#Ferguson	0
IF YOU DONT STAND FOR SOMETHING🚶👏🙏✊ \n\nYOULL FALL FOR \nANYTHING 🏃 🔫👮 \n\n#RipMikeBrown #Fergusonhttp://t.co/nLEabIVDhk	0
This puts it all in perspective. #Ferguson #MikeBrownhttps://t.co/1TDLeoJpIF	0
Embarrassed, 'activists"" morph from "why stop #MichaelBrown?" to "why so many shots?" Next it's "why not use a squirtgun?"\n#Ferguson\n#tcot	0
we want justice ... \n\n#RipMikeBrown #Fergusonhttp://t.co/JjCO1SVtpu""	0
For people who profess to LOVE the constitution - they sure VIOLATE it A-lot! #Ferguson #MikeBrown#HandsUpDontShoot	0
Georgia Rep. Hank Johnson proposed legislation on Thursday aimed at demilitarizing domestic police forces. http://t.co/JZFYPlfS3U#Ferguson	0
#MichaelBrown death in #Ferguson just one of many cases of police killing unarmed black people. What the data shows:http://t.co/EK9X1nKJ2U	0
Captain Johnson: ""Last night was a great night."#Ferguson	0
It's a lot more quiet here at #qt as Capt. Johnson speaks. One guy just yelled ""we want answers." #ferguson #ksdkhttp://t.co/XpWHqqvzl6	0
Thoughts are with #Ferguson. We need 2 collectively take a stand against senseless violence that confronts our youth.http://t.co/skxSjMHzF8	0
Captain Johnson: ""What happened last night is what's going to happen here forward."#Ferguson	0
#Ferguson shows how a militarized police force can compromise our rights and our safety #JusticeForMikeBrownhttp://t.co/pNIamkQAEi	0
Ron Johnson says he would have liked to been consulted by #ferguson chief Jackson about today's release of info.http://t.co/5GSXss901U	0
Most-shared #Ferguson news images, as published on @mashable \nhttp://t.co/EG1uF1y5dO\nLINK: http://t.co/LSOpxeYLCthttp://t.co/bMjf7TjtLP	0
Captain Johnson: ""You're going to see a bunch of smiles, a bunch of hugs, and a bunch of conversations" tonight in#Ferguson.	0
Captain Johnson: ""In our anger we have to make sure we don't burn down our own house."#Ferguson	0
It's nice to see officers with name tags on from Missouri State Highway Patrol. #Ferguson cops still not wearingthem.	0
#Ferguson: Towns Don't Need Tankshttp://t.co/304W7l7neh	0
Captain Johnson says #Ferguson police did not consult with him before they released the name of #DarrenWilson. He wishes theydid.	0
I stand with#Ferguson.	0
Very eager to hear why #Ferguson Chief Tom Jackson didn't tell new man in charge, Capt. Johnson, he was releasing #MikeBrown incidentreport	0
Captain Johnson: ""This is our opportunity to show that you can trust (police)."#Ferguson	0
Captain Johnson: ""I know we're scared and I know we've fallen. But I know He's going to pick us up."#Ferguson	0
@GovJayNixon: ""I think the focal point here still remains to determine how and why #MichaelBrown was killed and to seek justice."#Ferguson	0
You can say what you want about #MikeBrown but that doesn't make him guilty. That police officer though? He killed him.#Ferguson	0
Missouri Governor Jay Nixon is delivering remarks on the Mike Brown case.#Ferguson	0
And how are some of y'all so quick to believe the same police dept. that threw tear gas at folks in their gatdamb front yards.#Ferguson	0
#Ferguson is 60% black, but virtually all its cops are white. http://t.co/U7Yk4s4nyEhttp://t.co/gHlnoPH4dK	0
At my request, US Comm'n on Civil Rights approves letter to DoJ requesting inquiry into racial composition of #Ferguson PD and CityCouncil	0
Community asks Nixon, ""why was your response delayed to our community?"#Ferguson	0
If Michael Brown had been carrying a gun, would Republicans still say he had a right to bear arms? Or is that only for white men?#ferguson	0
Second lawsuit filed yesterday by @aclu_mo to protect #right2photograph &amp; video police public activity in #Fergusonhttp://t.co/yMVAOOh5xD	0
This is what they call ""justice" in #Fergusonhttp://t.co/mKnPV1LU4J	0
Why has no reporter interviewed the 'Brown' convenience store 'desi' owner in #Ferguson, robbed by Michael Brown?http://t.co/hSLilKVta0	0
Harvard students stand in solidarity with #MikeBrown &amp; the #Ferguson community. #HandsUpDontShoot #HBLSAhttp://t.co/eKiMdz0MIr	0
Da man wit the chips" in this iconic photo from #Ferguson has been identified. http://t.co/20Cn7JKmTUhttp://t.co/ES4SXqalOf	0
Everyone assumes everyone has a gun in America. And they're usually right. That's the problem. #MichaelBrown#Ferguson	0
#Ferguson #WeArePeace Met a young man who told me, ""We aren't here for colors. Black isn't a color, We are all Equal http://t.co/yO18uiiOPZ	0
Beautiful statement from Palestinians expressing support &amp; solidarity w/ #MikeBrown &amp; ppl of #Ferguson http://t.co/cnL7n2tc28 via@RanaGaza	0
This is all so disturbing #DONTSHOOT #Ferguson #MikeBrown something needs to be done but it aint riots. Peaceful acts. We have to valuelife	0
Full *Redacted* police report on #MikeBrown and #Fergusonhttp://t.co/Tn27pdWOVq	0
How did suburban cops in #Ferguson get weapons of war? Get the facts on the 1033 program: http://t.co/j99ubusJMchttp://t.co/PnkeYtRTCu	0
Much to say about #Ferguson… but can’t be bothered w/a fallen 2 star General… The Pres. is an abomination! #Greenehttp://t.co/pLNlq69eyS	0
Dear media:\nIf Michael Brown's race is mentioned in a news report, so should officer Darren Wilson's race.#Ferguson	0
Fyi cigars in #Ferguson cost $38million.	0
Friends, the #Ferguson police aren't incompetent. They are building a defense &amp; know they don't have to work hard atit.	0
The #TeaParty was unable to stand up to Goverment tyranny in #Ferguson due to being too busy tweeting about President Obama's golfgame.	0
“When you dress police up like soldiers, they start thinking like soldiers. And soldiers engage an enemy.” http://t.co/PtrZIIiIHb#Ferguson	0
The face of Black America each time @donlemon speaks about or to us. #Ferguson #MikeBrownhttp://t.co/7mFxnTT3Qd	0
Congress considering legislation to demilitarize local police in wake of #Ferguson brutality http://t.co/A3dpQHdcJkhttp://t.co/SsxfBQm7gK	0
When and where - #MikeBrown shot by police officer Darren Wilson in #Ferguson http://t.co/gCy99f2T5Zhttp://t.co/kr1ZjFFJ51	0
Photos from #Ferguson and 1960s protests side by side show not much has changed in the past 50 yearshttp://t.co/ELVgaAwURj	0
In debate over #Ferguson, REMEMBER: defense industry campaign cash flowed to lawmakers who backed militarizing policehttp://t.co/u01sBdRaZo	0
So, many of those calling for transparency yesterday are condemning police for what they released today. Can’t have it both ways.#ferguson	0
PHOTOS: New Yorkers write their thoughts in peaceful protest: http://t.co/mC0M9xbWG3  (Victor Mirontschuk) #Fergusonhttp://t.co/4JKxvjr6Ln	0
These 3 words say it all. #ferguson #MikeBrownhttp://t.co/Wuzy0YVEUg	0
Today the world is a world of tyranny and lies. The flag of #HumanRights is borne by enemies of human rights w/US leading them!#Ferguson	0
Muslims butchering Muslims=no biggie 'til an Israeli kills 1. U.S. blacks killing other blacks=non event 'til a cop kills1\n#ferguson\n#tcot	0
Know your rights: What to do if you're pulled over by a cop https://t.co/wjP7lZgpNZ #fergusonhttp://t.co/h8Pd9vHyz9	0
Look at how US govt treats black community! It's not about 50-100 years ago but it's about today!#Ferguson	0
HERE ARE 50 QUESTIONS! about report released today in #Ferguson, please read https://t.co/YOETZl7uKW”. CHECK THEMOUT!!!	0
#Ferguson #MikeBrown RT @cjayconrod: Day 2 of making bag lunches for protesters &amp; volunteers.http://t.co/nCnHHLMWOB	0
Wait, why aren't the cops pointing assault rifles at these protestors? #fergusonhttp://t.co/xVsp93WUVN	0
Racial discrimination's still a dilemma in US. Still ppl are unsecure for having dark skins.The way police treat them confirms it.#Ferguson	0
Police begged media for discretion about location of q&amp;a. Are set up about half a mile from QuikTrip/protest site#Ferguson	0
Brutal treatment of black ppl isn’t indeed the only anti-human rights act by US govt;look at US’s green light to #Israel’s crimes.#Ferguson	0
Don't believe shit you see on TV. Residents of #Ferguson LIVE TWEETED this entire ordeal and we watched itunfold.	0
Again, we are seeing why we need a federal government.#Ferguson	0
What #Ferguson Chief of Police Thomas Jackson did wasoutrageous!	0
The #Ferguson police chief has endangered #PeaceInFerguson and someone should take his microphone away. Let the big boys handle thisnow.	0
After 10+ minutes, Chief Jackson abruptly ends press conference while questions still being yelled at him. #MikeBrown#Ferguson	0
INDICT CHIEF TOM JACKSON for conspiracy and aiding &amp; abetting. INDICT DARREN WILSON for murder. Convict both. #ferguson#mikebrown	0
I don’t know if the #Ferguson police chief is acting out of malice or ignorance, but either way, he’s the face the problem rightnow.	0
A message for #Ferguson, from #Palestine #Gazahttp://t.co/VZtLCYyZnu	0
At Quik Trip in #Ferguson this lady has set up table people to vote.http://t.co/geVZoPZWuX	0
RT @FreeTopher: OFFICER DARREN WILSON STANDING OVER MIKE BROWN'S BODY AFTER SHOOTING HIM 9 TIMES #Fergusonhttp://t.co/7uAMFPdyPO	0
They didn't give the chief no type of time to rehearse his lines and now he stuck looking like... #Fergusonhttp://t.co/2fL1yMZFUQ	0
“Which cop killed #MikeBrown?”\n\n“Sorry. Can’t tell you that.”\n\n“Why’d you release the video?”\n\n“Because you asked.”\n\n#MikeBrown#Ferguson	0
Rapper J. Cole releases ‘Be Free,’ inspired by Michael Brown in #Fergusonhttp://t.co/IOhCDqcPkS	0
Mother/Daughter team in #Ferguson.  Daughter just took bar.  Will be civil rights Attyhttp://t.co/m7grH0ng2o	0
Wow. Turkish pro-gov newspaper claims US media totally ignored #Ferguson, news blackout etc.. http://t.co/tCQs13M0sRhttp://t.co/siuPC0MtZK	0
Video footage of my arrest, @AntonioFrench staffers, and Michael Powers Protest and arrests 8-13-14: http://t.co/RLaAUlKyyv#Ferguson	0
Exactly How Often Do Police Shoot Unarmed Black Men? http://t.co/6KXMOhu2EA #Fergusonhttp://t.co/1Cd6egf2LQ	0
AG Eric Holder called Ron Johnson this afternoon, called approach a “model of community-based policing.”#ferguson	0
Homeland Security has given $34 billion to local police to militarize in the name of 'counterterrorism.' http://t.co/2kHhe0O71G#Ferguson	0
The #Ferguson killing was live-tweeted. https://t.co/BPPYbOlw5h via@7im	0
The death of Mike Brown was live tweeted http://t.co/UJNhP9jNeD via @7im#ferguson	0
A message for #Ferguson, from #Palestine #Gazahttp://t.co/YAP5ecERTz	0
New Video of SWAT Team Attack on Al-Jazeera in #Ferguson You Haven't Seen - Please RT to expose lying copshttp://t.co/aM1ipHTMO7	0
Wait, why aren't the cops pointing assault rifles at these protestors? #fergusonhttp://t.co/H1mvIEx9hD	0
The oppressed stands with the oppressed.\n\n#Palestine stands with #Ferguson.http://t.co/OAubDhcxeW	0
How many #Ferguson officers are in the KKK?#jw	0
Just be ready. When #Ferguson PD release the photo of #DarrenWilson, it will look something like this.http://t.co/JLT5TuaNdD	0
The oppressed stands with the oppressed.\n\n#Palestine stands with #Ferguson.http://t.co/IEltHrA8jQ	0
“Information might have dispersed more crowds than armored vehicles did.” @jelani9 on questions raised in #Ferguson:http://t.co/Bwclyxie7i	0
How can you not be moved by the people of#Ferguson\n\nhttps://t.co/iQKZ13M3SQ	0
When a policeman asks 'why are you filming?' ...\n#tcot #uniteblue #teaparty #gop #fergusonhttp://t.co/3Dlod16f5I	0
Whether it's a woman who has been raped or a black man gunned down, we live in a culture that blames non-white, non-male victims.#Ferguson	0
Local prosecutor deciding whether to charge killer cop thinks #Ferguson cops were doing a great job this week.DANGER	0
...they acting good now because y'all are here. But what you think's gonna happen when y'all leave? Tell *that* story."#Ferguson	0
#Ferguson chief says officer Darren Wilson devastated. Mike Brown unavailable for comment about his feelings becausedead.	0
