Educated guess: possible reason they didn't release shooter's incident report--he didn't write one on advice of his lawyer.#Ferguson	1
ICYMI: The info given today seems to line up with this witness account, even the alleged theft: http://t.co/7hjBIrf1a3\n\n#Ferguson#MikeBrown	1
#Ferguson police chief now says that the robbery DOES NOT relate to the initial contact between Darren Wilson and MichaelBrown	1
Chief Jackson: initial contact between officer and #MikeBrown was not related to robbery.#Ferguson	1
#Ferguson police chief just confirmed that officer's interaction with Michael Brown NOT related to therobbery.	1
#Ferguson Police Chief: The initial contact between #DarrenWilson and #MikeBrown was NOT related to the alleged theft ofcigars.	1
Why release the report about the robbery if it's not related to the contact with the cop who shot him? This all stinks.#Ferguson	1
WOW RT @themarkberman: ""The initial contact between the officer and Mr. Brown was not related to the robbery," #Ferguson police chiefsays	1
I know his initial contact was not related to the robbery," #Ferguson chief says. "It was related to blocking theroad."	1
BOMBSHELL: #Ferguson chief says the police officer might not have even known about the robbery when he shot and killed MichaelBrown.	1
Chief Jackson: officer was not aware that #MikeBrown was a robbery suspect.#Ferguson	1
Chief seems to make it very clear that shooter did NOT write an incident report. 5th Amendment.#Ferguson	1
#Ferguson Police Chief confirms when officer stopped #MikeBrown, he was not aware he was a suspect in arobbery.	1
Q: Why did he stop Michael Brown? ""Because he was walking down the middle of the street," #Ferguson chiefsays.	1
The #Ferguson police chief confirmed the stop of #MikeBrown had absolutely nothing to do with the alleged convenience storerobbery.	1
The officer who shot #MikeBrown did NOT know he was a suspect in a robbery, according to #Ferguson police chief. They were notrelated.	1
This #Ferguson PD chief press conference is AMAZING... he just ADMITTED Darren Wilson stopped him bc of thejaywalking.	1
Police chief said officer who shot Brown didn't know about any robbery#ferguson	1
Exactly. Why release the video if stopping Mike Brown was not related to the robbery? JESUS CHRIST THIS IS BAD.#Ferguson	1
Q: ""why did he stop Michael Brown?" \n\n#Ferguson Police Chief: "because they were walking down the middle of the street blockingtraffic"	1
Lawyers for police in bad shootings often advise shooters not to write reports or even speak to commanders or investigators.#Ferguson	1
#Ferguson police chief says he released the robbery video because he was getting FOIA requests for it. How did anyone know to requestit?	1
Asked why he released surveillance video of robbery, Chief Jackson responds, ""because the press asked for it." #MikeBrown#Ferguson	1
Chief Jackson: officer Darren Wilson stopped #MikeBrown initially because he was in the street and blocking traffic.#Ferguson	1
the media didn't even know the video existed, but he just said they requested it? DUDE.#Ferguson	1
Wow! What was the point of bring out the robbery footage today if it had nothing to do with Michael Brown being stopped?#Ferguson	1
so ... they clearly released that video  only to shame &amp; blame the victim. #Ferguson#MikeBrown	1
So since we now know the officer knew nothing abt a robbery, we must ask why those tapes were released? #Ferguson. But we knowwhy.	1
Key point: Officer Wilson was not aware that #MikeBrown was a robbery suspect. It will be key in establishing his state of mind.#Ferguson	1
shorter #ferguson pd: ""damn, we thought we could dirty up this guys name, we didn't think you guys wouldCHECK"	1
Ferguson PD now admits that Darren Wilson didn't know anything about the store robbery when he stopped Mike Brown! This is bad!#Ferguson	1
Cop who shot Brown did not know he was a robbery suspect, #Ferguson police chief says http://t.co/9pWsMI9HOjhttp://t.co/urxcAQk7Uy	1
The #Ferguson police chief just basically confirmed #MikeBrown was gunned to death for the crime of walking in thestreet?\n\nHorrific.	1
What's so frustrating is that now we are talking about a robbery and not the killing of an unarmed kid.#ferguson	1
They released that information this morning about the robbery KNOWING #MikeBrown wasn't stopped for it? Explain why. EXPLAIN. WHY.#Ferguson	1
So, to sum up: 1) Darren Wilson KNEW NOTHING of the robbery, 2) shot #MikeBrown over jaywalking, and 3) was allowed to escape#Ferguson.	1
#Ferguson chief said the officer was unaware of any robbery &amp; stopped #MikeBrown for jay walking. #TheJighttp://t.co/uLWzIJH5WJ	1
Are we supposed to be cool &amp; remain calm when the police after MURDERING a teenager SLANDER him to hide the killing behind racism?#Ferguson	1
#Ferguson police chief says officer Darren Wilson didn't know #MikeBrown was a robbery suspecthttp://t.co/SbpxzwwZWs	1
They desecrated #mikebrown's body then they desecrated his memory and plight for justice. \n\nEXPLAIN THIS. \n\n#Ferguson#DONTSHOOT	1
I'm so disgusted. #Ferguson RT @ZandarVTS: This has now devolved into the worst police shooting cover-up attempt in UShistory.	1
Report: #Ferguson cop identified as unarmed teen's killer skipped town days agohttp://t.co/5GQvgcw3LJ	1
VIDEO Police release surveillance tape from #Ferguson store related to #MichaelBrown: http://t.co/hEIdfPTX60http://t.co/CIM7L6TJND	1
Increasingly seems like #Ferguson police dept. spent all week playing dress-up, couldn't even be bothered to get its storystraight	1
In what world do you let a cop who killed someone leave town? http://t.co/T0A3rn2PeL#Ferguson	1
#Ferguson Police Chief says #MikeBrown was stopped because he was walking in road NOT because he was suspected of stealingcigars.	1
Oh, whoops, the robbery had nothing to do with #MikeBrown being stopped, but at least now half of America thinks it did. - #FergusonPD	1
.@CNN KEEPS playing the video while saying it has nothing to do with the murder of #MikeBrown this is PSYCHOLOGICAL WARFAE.#FERGUSON	1
If anyone's looking for a reason to murder me execution-style in the street, I stole a coke from a Walmart when I was 19.#Ferguson	1
UPDATE - Shooter #DarrenWilson didn't know #MikeBrown was a robbery suspect: #Ferguson http://t.co/p05krSfaXLhttp://t.co/R8CJVoTvex	1
This is what #Ferguson PD did to #HenryDavis in 2009 when they mistook him for a man with an outstanding warranthttp://t.co/ZdHpyHfrCh	1
Since FBI is investigating the shooting, isn't Darren Wilson a fugitive &amp; the cops who let him leave accessories after the fact?#Ferguson	1
to be clear: an unarmed teenager POSSIBLY stealing a box of cigars does not warrant being shot to death by the police.#Ferguson	1
People got even angrier after the admission that the #Ferguson store theft had nothing to do with why Brown was stopped byWilson.	1
#Ferguson PD charged #HenryDavis w/ ""destruction of property" for bleeding on their uniforms: http://t.co/qQWPClW3tGhttp://t.co/5U3nMoMiF2	1
Oh. So NOW the #Ferguson police chief says the cop didn't know about the robbery when he stopped #MikeBrown. The kid was ""jaywalking"?BS!	1
Anybody else thinks the #Ferguson police chief is just making this up as he goes along? This is beyond embarrassing. It'sshameful!	1
Report: #Ferguson Cop ID'd As Unarmed Teen's Killer Left The Area Days Ago \nhttp://t.co/fZROKS30VChttp://t.co/QAYkm1ielh	1
#Ferguson police: Officer involved in fatal shooting of Michael Brown didn't know he was suspect in alleged robbery.http://t.co/L6bieyrz2a	1
Officer in shooting death of MIchael Brown was unaware he was a suspect: #Ferguson police http://t.co/ZdxP58Ptqthttp://t.co/ypfN4DmMZi	1
Report: #Ferguson police beat up wrong suspect then charged him for getting blood on uniforms in 2009http://t.co/Mck8FYYOpp	1
#ferguson police engaged in character assassination to cover up actual assassination. you. simply. don't. shoot. unarmed. teenagers.EVER.	1
now shameful #ferguson police say Brown wasn't even a robbery suspect when he was shot. he was just an unarmed kid walking down thestreet.	1
WOKE. #Ferguson #mikebrown RT @ChamNature: 10 mins RT @DragonflyJonez: 6'4 290. In sandals. RT @_TheSpeakEasy: Hmmhttp://t.co/urAzIWRNI6	1
American Justice?! #MikeBrown #FergusonShooting #Ferguson #PoliceBrutality ##JusticeForMikeBrownhttp://t.co/jgIwMophkl	1
Hard to believe this guy assaulted a cop. 😂😂😂 \n\n#Fergusonhttp://t.co/J86VLXnZF6	1
#ThatAwkwardMoment when the #Ferguson police chief admits that #MikeBrown was stopped for walking in the road.\n\n#p2http://t.co/6giGtKQgaB	1
Everybody was orgasming about a white cop killing an ""innocent" black kid. Reality kicked them in the nuts. #Fergusonhttp://t.co/hUx29W6P10	1
#Ferguson chief let most of day go by b4 disclosing (after repeated Qs) that cop who killed #MikeBrown knew nothing about robbery.DANGER	1
Store owner told @FOX2now Monday that there was a theft, but said it was not MichaelBrown; said it was someone else#Ferguson	1
FACT. We know more about how #MikeBrown allegedly stole cheap cigars than how and why a #Ferguson police officer shot and killedhim.	1
The press conf makes #Ferguson PD look like they've gone from stonewalling to counter punching. We give up a name, we drag his thru themud.	1
#Ferguson Police: Video Shows Michael Brown Strong-Arming Store Clerk http://t.co/Nm8bHDdUz7http://t.co/mgdyuatgFE	1
Is the Police Chief in #Ferguson changing the story? https://t.co/8ujqp0lpb5	1
MSNBC is literally reporting that Police Chief CLEARLY said it was about jay walking. \n\nThis is a fucking clown show.#Ferguson	1
Police in #Ferguson once charged a man for bleeding on their uniforms after 4 of them beat him http://t.co/op11jbVEUqhttp://t.co/crECAGF4t0	1
Remarkably, despite the military-style police presence in #Ferguson, a known killer was able to skip townhttp://t.co/lDGjp6Wt1j	1
Americans are 8 times more likely to be killed by a police officer than by a terrorist.#Ferguson	1
Shot ten times.\nUnarmed.\nWhat else is there to talk about?\n#StopTheSmear#Ferguson	1
I refuse to call the #Ferguson police chief incompetent when it is so clear the release of that video was calculated and brazen.#MikeBrown	1
Police in #Ferguson once charged a man w/ destruction of property for bleeding on their uniforms after they beat himhttp://t.co/MRVP76sdUP	1
Black teenage boys are not men. They are children. Stop referring to a 17 year old as a man. You are killing children.#ferguson	0
The mother of the boy killed in #Ferguson speaking to media about the loss of her son.http://t.co/YlxEDKoebB	0
Police have brought out the large gear in #Ferguson.http://t.co/2gxUzOvwfy	0
Omg Wow ""@FLOCKAfierce: WOW RT @AntonioFrench: Police have brought out the large gear in #Ferguson.http://t.co/4t4RRtNWRk"	0
When you see citizens as enemies... RT @AntonioFrench: Police have brought out the large gear in #Ferguson.http://t.co/xTwwfXC8zy""	0
Police of #Ferguson murdered a boy in cold blood. Now they're spinning the story &amp; intimidating the community intosilence.	0
Here’s to hoping what’s happening in STL right now doesn’t get worse. #Ferguson hashtag not looking good right now.http://t.co/0fhU5EopGa	0
When you are black &amp; the victim of a crime, people will dig up something you did in kindergarten to justify what happened to you.#Ferguson	0
Patrol cars still flood the streets in #ferguson more than 6 hours after police officer shot teenager @ksdknewshttp://t.co/fCCGAfIRbG	0
America doesn't think we're human, the world doesn't think we're human, and cops don't get punished for killing us for no reason.#ferguson	0
Another day, another shooting of an unarmed black teenager in America by authority figures. #STL#Ferguson	0
People are now matching to the #Ferguson Police Dept headquarters.http://t.co/4KEsby2ZPj	0
Being Black in this country is dangerous business.#Ferguson	0
People marching to the #Ferguson Police Dept headquarters following the killing of a 17-year-old boy.http://t.co/ROvs3mXYMM	0
Many police officers today operate from fear and prejudice. That's dangerous when you have the power to take a life.#Ferguson	0
The #Ferguson shooting shows that being passive leads 2 more injustice. If a Black cop shot an unarmed white teen, Ferguson would be onfire	0
Police aren't being taught to protect and serve anymore. They are being taught to shoot first, explain later.#ferguson	0
Yes @stltoday describe people protesting police officer killing Michael Brown as ""mob". Then, edit, "crowd" #fergusonhttp://t.co/xG3Hm8JLWy	0
#WeAreTargets: People marching to the #Ferguson Police Dept headquarters following the killing of a 17-year-old boyhttp://t.co/wFTR1maej7""	0
This is not a ""black" loss. This is a loss for America, and everyone should be concerned, outraged &amp; involved.#Ferguson	0
If Michael Brown had been white, @stltoday would have described crowd not as a ""mob", but as a 'heartbroken community'.#Ferguson	0
calling the neighbors a mob = dehumanizing a community to justify all future wrongdoing. #mikebrown#ferguson	0
call weeping neighbors a mob --&gt; paint a picture of a violent community #MikeBrown came from --&gt; justify his execution#Ferguson	0
So would that ""angry mob" in #Ferguson also qualify as "concerned citizens"? What's the difference, skin color?#justice4all	0
Unfollow me NOW if you're like ""Why was he running?" or tweeting ANY justification 4 the murder of #MikeBrown by #Fergusoncops.	0
PAY ATTENTION as ""teen" becomes "man," "community" becomes "mob," and "murder" becomes "alleged shooting." #Ferguson#medialiteracy	0
Reminder that this is legal, but young unarmed black men are threatening and make us ""uncomfortable"  #Fergusonhttp://t.co/VbRyW7J9nR	0
Interview with mother of victim. The police wouldn't let her ID her own son http://t.co/jUonPxq4TW#Ferguson	0
Police murder another unarmed 17 yr old blk kid &amp; police show up like this. I can't take it! #Ferguson #WeAreTargetshttp://t.co/RuZ8YAgGPr	0
To all white ppl horrified by #Ferguson: go to police, school board, &amp; mayor and teach how anti-blackness kills. They don't listen tous.	0
The mother of #MikeBrown, the 17-year-old killed by #Ferguson police today, says her son was about to start at Vatterott College nextweek.	0
: Teenager #MikeBrown won't start college on Monday because he was shot ten times by a #Ferguson police officer.http://t.co/dCFmzlkFRD”	0
How many unarmed black teenagers will be killed in America? \n\n#ThatIsTheQuestion\n#Fergusonhttp://t.co/5L8043MSaP	0
The 18 year old victim had no weapon and his hands in the air and was still shot multiple times." https://t.co/kTIEq8TkkC#Ferguson	0
Mike Brown was to start studying at Vatterott College on Monday.#Ferguson	0
Notice it's ""involved in the shooting" not "killed a child." \nNotice it's "paid administrative leave" not "has beenarrested"\n#Ferguson	0
The police officer who killed Mike Brown has been put on paid administrative leave.#Ferguson	0
Michael Brown was due to begin classes at Vatterott College tomorrow.\n\nHis mother mourns his loss:\n\n#Fergusonhttp://t.co/YMSK7Skp9y	0
Multiple witnesses have told the media in #Ferguson, that Mike Brown had his hands up when he was shot ""multiple" times by policeofficer.	0
Black bodies are no longer swinging from trees, they are laying on the streets.  #Ferguson #detriot #oakland #nyc#usa	0
Michael Brown was supposed to start classes at Vatterott College on Monday. Instead gunned down in street by #Fergusonpolice.	0
Favorite this now: In the next week, we will hear about EVERY transgression #MikeBrown has ever had since soiling his diapers.#Ferguson	0
Teenager #MikeBrown won't start college on Monday because he was shot ten times by a #Ferguson police officer.http://t.co/A4RJS4unlx	0
People are gathering at the site where #Ferguson police killed 17-year-old #MikeBrown. Police have swarmed the area.http://t.co/NlqbthTiAc	0
The police presence in #Ferguson following the shooting of Michael Brown was mind blowing.http://t.co/UGdNcWtpbH	0
Rose petals and candles have been placed in the street where #MikeBrown's body laid. #Fergusonhttp://t.co/kCn4dHqNwQ	0
People in the street shouting ""No Justice, No Peace" and blocking a Kinloch police car from passing. #Fergusonhttp://t.co/7jp4rqT4G6	0
Rest in Peace Mike Brown.#Ferguson	0
The crowd has forced the police car to reverse. #fergusonhttps://t.co/B9YqGhq0hZ	0
America: Where an unarmed black teen gunned to death by the cops isn't seen as a victim, but a white kid on a shooting spree is.#Ferguson	0
They've brought the dogs out in #Fergusonhttps://t.co/gXQeLtaXjt	0
An unarmed 17 year old kid shot 10 times &amp; once in the HEAD?!?!\nNot sure how you can ""spinthat".\n#Ferguson	0
#Ferguson Regardless of what color you are; the militarized police response here is BONECHILLINGhttp://t.co/uumztSc6c8	0
#Ferguson police have brought dogs into neighborhood. Residents protest with hands in the air. Tension is growing...http://t.co/BxYIsHHjnE	0
Things are getting very tense in #Ferguson.https://t.co/2pDUHAR2B7	0
Someone remind me what year it is again. Cops shoot unarmed young man then bring the dogs out to ""handle" the crowd. #Ferguson#MikeBrown	0
Right now in #Ferguson, MO following the killing of 17-year-old #MikeBrownhttp://t.co/caqdthrkq0	0
The only reason those cops haven't gone all Selma on the people in #Ferguson is because the cameras are rolling. That'sit.	0
Rest in Peace, Michael Brown. 17 forever.\n\n#Fergusonhttp://t.co/fMq9mJRwtL	0
Awful. RT @AntonioFrench #Ferguson Police have dogs and shotguns. The unarmed crowd is raising their hands.https://t.co/OFXxJLuDtj	0
Black people die 2 deaths: 1) by public execution &amp; 2) an assassination of their character to justify the murder. #Ferguson#MikeBrown	0
They broke out the terrorist response gear for citizens in #Ferguson protesting cold blooded police murder. Are we still inAmerica??	0
What year are we in again? This is looking like the 50s #Fergusonhttp://t.co/TeLcT3d3yh	0
The police in #Ferguson are using military suppression tactics on unarmed civilians. That's not law enforcement,b.	0
Situation in #Ferguson getting very tense after police killed unarmed teenager Mike Brown (photo: @AntonioFrench)http://t.co/gL3y9pkfV7	0
Police dogs snarl at a crowd of mourners in #Ferguson. They are mourning the killing of another teenager by policehttp://t.co/BVGJAu2jvV”	0
Someone please remind me what year it is again? #fergusonhttp://t.co/33cebmojwV	0
Crazy RT @brennamuncy: Someone please remind me what year it is again? #fergusonhttp://t.co/0rmR6PhSvi	0
The cop who shot #MikeBrown is on paid leave. \n\nShoot a black kid, get a paid vacation. #WeAreTargets#Ferguson	0
The police have come into the community with dogs. #fergusonhttp://t.co/QWhlu0xEtB	0
Cops gun down a 17-year-old in front of you &amp; lock down your neighborhood with scores of armed cops because THEY feel threatened#Ferguson	0
Never forget the original relationship between the police and blacks...\n#wearetargets\n#Fergusonhttp://t.co/Y0dOOu4LbE	0
#message RT @brennamuncy: Someone please remind me what year it is again? #fergusonhttp://t.co/vI4tDnvT1W	0
Ferguson Police have dogs and shotguns. The unarmed crowd is raising their hands. #ferguson #fergusonshooting https://t.co/t2MLq3SsrV	0
RT @_westwest_yall: Never forget the original relationship between the police and blacks...\n#wearetargets\n#Fergusonhttp://t.co/Hbd4J61Va7	0
The #Ferguson chief, the County chief, County prosecutor, and @CharlieADooley need to reach out to the family and promise justiceTONIGHT.	0
Reach RT @brennamuncy Someone please remind me what year it is again? #fergusonhttp://t.co/1Yz0RPNFIT	0
White man with gun *goes* to Target. Black kid without gun *is* the target.#Ferguson	0
People are angry, frustrated but peaceful tonight in #Ferguson. The police dept's heavy handed approach made things worse. Leaving wasgood.	0
Dear mainstream media: The story is not the protest. The story is the police shooting of an unarmed black teenager.#Ferguson	0
Dogs? In 2014? #Ferguson RT @AntonioFrench: Right now in #Ferguson MO following the killing of 17-year-old #MikeBrownhttp://t.co/iniDpLhVgo	0
NOTICE: 0 evidence of ""kill the police" chant in #Ferguson but all news outlets report it, yet pics of lifeless victim? "Allegedshooting."	0
Police are leaving now. #fergusonhttps://t.co/tozjird2vf	0
Protestors at the #Ferguson Police Dept.https://t.co/0gAGopdQ8u	0
Michael Brown, unarmed black teen killed by police in #Ferguson was set to start college on Monday.@MichaelSkolnik:https://t.co/4LODno0FLr	0
Protest at #Ferguson police dept right nowhttps://t.co/zyZMLpgOpS	0
It's messed up when cops can shoot unarmed Black teen yet White people can walk around Target with AR-15's!#Ferguson	0
Protestors outside #Ferguson police department headquarters right nowhttp://t.co/sjHMxSulha	0
Don't live in #Ferguson? Call the Police station leave Chief Tom Jackson a message 314-522-3100 ext #5588 or tweet @stlcountypd#MikeBrown	0
Unarmed teen killed by cops isn't the headline but calling black people ""ANGRY MOB!" is, that tells you everything about the media#Ferguson	0
#WeAreTargets RT @brennamuncy: Someone please remind me what year it is again? #fergusonhttp://t.co/ZRJ00GRDZG	0
At the #Ferguson police dept headquartershttps://t.co/jIaKhelaAk	0
He threw his hands up and they shot him. The boy fell and they shot him some more." http://t.co/WTqOpAhVRw  #ferguson#mikebrown	0
Protest continues in front of #ferguson police dept ""the people united, will never be defeated" #FergusonShootinghttp://t.co/4wXq3z6tDX	0
The killing, the militarized police response, the coverage. How many more ways can you say ""Your lives hold no value"? #MikeBrown#Ferguson	0
I’m in #Ferguson and the witnesses are telling a chillin story. This young man was trulyexecuted.	0
This is not okay. #Fergusonhttp://t.co/hb3jH6GfAt	0
I can't stomach another #justicefor campaign. Real justice isn't a conviction. It's black ppl not being used for target practice.#Ferguson	0
Please note Twitter had the #Ferguson story BEFORE ALL national news outlets. \n\nBut keep telling me how Twitter doesn't matter.😒	0
Nothing screams action like placing pressure on the head of the city, Mayor Knowles. Call or email him! #Fergusonhttp://t.co/CvTxppaWWN	0
Witness: ""He threw his hands up and they shot him. The boy fell and they shot him some more." #Fergusonhttp://t.co/sSbXDOUTMn	0
Trayvon Martin. Jordan Davis. Renisha McBride. Mike Brown. Our streets are stained with the blood of unarmed, black teens.#Ferguson	0
Don't tell a heartbroken community how to feel, what to say. Try listening to them instead.#Ferguson	0
It's incredibly upsetting hearing about the execution of children by the authorities in Iraq, Gaza, and Missouri. #MikeBrown#Ferguson	0
Wonder how many breaking news reports there would be on national networks if a white unarmed teenager was shot + killed by police?#Ferguson	0
Follow @MichaelSkolnik NOW if you want to follow the story about the unarmed teenager who was killed by the #Fergusonpolice.	0
Young black victims are killed twice in America―once by gun, second by media. Let the victim be the victim this time.#Ferguson	0
No matter what COLOR you are...the murder by cop in #Ferguson is WRONG.  Let's stand together, do NOT let them divideus.	0
White-privilege apologist internet trolls saying, ""Wait for details before you jump to conclusions." You need more details?#Ferguson	0
The @latimes reports on #Ferguson - http://t.co/p69w3eaHpbhttp://t.co/3DtEAVnpkW	0
High school graduation picture of Mike Brown. May he rest in peace, while we fight for his justice. #Fergusonhttp://t.co/ZpWHsvpnQi	0
#MikeBrown, left, is gunned down for WWB (walking while black),but guy on the right can point a gun at cops #Fergusonhttp://t.co/ydAVrBLQke	0
Police in #Ferguson, Missouri, shot and killed a 17-year-old boy.http://t.co/TbVlOFxEus\n#FergusonShooting	0
People DEBATING whether #MikeBrown shoplifted or not-- IT DOESN'T MATTER.\nShoplifting isn't punishable by DEATH IN THE STREET.#Ferguson	0
Late reporting from #Ferguson: ""Unrest" outside police station. When white people do it, it's a "vigil."http://t.co/mkca1icOF9	0
If #Ferguson protesters were white, they'd be walking away with several hundred cattle and an apology. http://t.co/mkca1icOF9#p2	0
17-yr-old unarmed black kid #MikeBrown was murdered by a cop in #Ferguson, Missouri yesterday. This is his stepdad:http://t.co/p8mqVvh9GY	0
I don't want another bigot getting in my TL saying it's not abt race, when's the last time a white kid has been MURDERED by police#Ferguson	0
“When will young people of color's lives matter when they are alive?” -  @MichaelSkolnik #Fergusonhttp://t.co/NM5UsKgPVm	0
The difference between ""unrest" and "patriotism" is directly proportional to how black the protesters are. #Ferguson #Murrieta#BundyRanch	0
More coverage from Europe - http://t.co/Ipkmn3Zq45 #Ferguson #MikeBrownhttp://t.co/vbZSHAvmxK	0
The black &amp; unarmed group on the left is called an ""angry mob" vs the armed white group called supporters #Fergusonhttp://t.co/EuEvQHHEpK	0
#Ferguson, MO is in protest after a cop kills an unarmed black teen: http://t.co/xirnS3duFBhttp://t.co/T6Dp3AQbgE	0
#Ferguson is why we need Civilian Review Boards. Anger, frustration &amp; potential violence comes when ppl lack faith that they'll getjustice.	0
Stewart drives over guy kills him. News is everywhere. Cops fire 10 bullets into unarmed black. Not even covered. Good job media.#Ferguson	0
Protestors outside #Ferguson police dept nowhttp://t.co/VYsGspeKPB	0
Teenager #MikeBrown won't start college on Monday because he was shot ten times by a #Ferguson police officer.http://t.co/mUE41Zp4nA	0
